5407803629,톰포드뷰티 샌탈 블러시 EDP 50ml,판매중,322000,있음 -> 품절
5407792130,에스티로더 어드밴스드 나이트 리페어 아이 컨센트레이트,판매중,100000,있음 -> 품절
5394636187,조말론런던 와일드 블루벨 헤어 미스트 30ml,판매중,71000,있음 -> 품절
5393954625,크리니크 포 맨 차콜 페이스 워시,판매중,37000,있음 -> 품절
5393915871,크리니크 노란로션(젤) 200ml 대용량,판매중,57000,있음 -> 품절
5393914674,크리니크 래쉬 파워 마스카라 6g,판매중,36000,있음 -> 품절
5393504710,입생로랑 롬므 오 드 뚜왈렛 100ml,판매중,140000,있음 -> 품절
5393493087,입생로랑 라 뉘 드 롬므 오 드 뚜왈렛 100ml,판매중,140000,있음 -> 품절
5357868266,딥티크 럭셔리어스 핸드밤 45ml,판매중,54000,있음 -> 품절
5357531765,딥티크 룸스프레이 베이 150ml,품절,82000,품절 -> 있음
5350796941,딥티크 오드퍼퓸 오듀엘르 75ml,품절,210000,품절 -> 있음
5350766547,딥티크 캔들 르르두떼 220g,판매중,129000,있음 -> 품절
5350726894,딥티크 플러그 디퓨저 본체,판매중,165000,있음 -> 품절
5319690701,키엘 수분 탄력 에센스 50ml,판매중,85000,있음 -> 품절
5311244182,톰포드뷰티 페이스 프로텍트 SPF50+/PA++++,판매중,85000,있음 -> 품절
5301801943,비오템 레꼬포렐 샤워밀크 200ml,판매중,36000,있음 -> 품절
5301796665,비오템 라이프 플랑크톤 클리어 에센스 125ml,판매중,65000,있음 -> 품절
5301787553,비오템 라이프 플랑크톤 온천수 에센스 125ml,판매중,65000,있음 -> 품절
5262456006,톰포드뷰티 로스트 체리 캔들,품절,139000,품절 -> 있음
5260287199,라메르 클렌징 젤 200ml,판매중,135000,있음 -> 품절
5260137575,라메르 트리트먼트 로션 150ml 세트 (클렌저 디럭스 듀오 증정),판매중,202000,있음 -> 품절
5259655620,라메르 모이스춰라이징 소프트 크림 30ml,판매중,225000,있음 -> 품절
5259635680,라메르 아이 컨센트레이트 15ml 세트 (집중 케어 디럭스 듀오 증정),판매중,280000,있음 -> 품절
5259631437,라메르 아이 컨센트레이트 15ml 세트 (눈부시게 화사한 눈가),판매중,280000,있음 -> 품절
5259628580,라메르 NEW 아이 컨센트레이트 15ml,판매중,280000,있음 -> 품절
5259622067,라메르 리프팅 아이 세럼 15ml,판매중,325000,325000 -> 335000,있음 -> 품절
5259550756,라메르 모이스춰라이징 매트 로션,판매중,350000,있음 -> 품절
5259538593,라메르 수분케어 세트,판매중,375000,있음 -> 품절
5259241522,라메르 NEW 리제너레이팅 세럼 30ml,판매중,435000,있음 -> 품절
5259221133,라메르 NEW 컨센트레이트 장벽강화 세럼 50ml 세트,판매중,615000,있음 -> 품절
5259213217,라메르 컨센트레이트 50ml 세트 (장벽강화 세럼),판매중,615000,있음 -> 품절
5259208350,라메르 크렘 드 라 메르 100ml (2020 블루 하트 리미티드 에디션),판매중,625000,있음 -> 품절
5259017332,라프레리 슈프림 밤 클렌저 100ml,판매중,200000,있음 -> 품절
5258988336,라프레리 안티-에이징 아이 크림 SPF 15 15ml,판매중,251000,있음 -> 품절
5258981638,라프레리 엑스트레 오브 스킨 캐비아 퍼밍 콤플렉스 30ml,판매중,257000,있음 -> 품절
5258877328,산타마리아노벨라 바뇨쉬우마 알게마린,판매중,59000,있음 -> 품절
5258866693,조르지오아르마니 크레마 네라 아쿠아 판텔레리아 워터에센스,판매중,210000,있음 -> 품절
5244507803,나스 미니 브러쉬 세트,판매중,79000,있음 -> 품절
5241053433,산타마리아노벨라 아쿠아 디 로즈 500ml - 장미수,판매중,70000,있음 -> 품절
5238384572,산타마리아노벨라 라떼 꼬르뽀 워모 250ml,판매중,115000,있음 -> 품절
5236809548,블랑 소파베드,판매중,150000,있음 -> 품절
5236732862,산타마리아노벨라 4계절 방향 스프레이 (겨울),판매중,128000,있음 -> 품절
5221929946,슈에무라 슈에무라X원피스 컬렉션 미니 립 키트,판매중,69000,있음 -> 품절
5221926098,슈에무라 슈에무라X원피스 컬렉션 미니 클렌징 오일 키트,판매중,49000,있음 -> 품절
5221915941,슈에무라 슈에무라X원피스 컬렉션 미니 브러쉬 세트,판매중,80000,있음 -> 품절
5221912343,슈에무라 슈에무라X원피스 컬렉션 페탈55 브러쉬,판매중,72000,있음 -> 품절
5221907864,슈에무라 슈에무라X원피스 컬렉션 얼티메이트+ 클렌징 오일 450ml,판매중,135000,있음 -> 품절
5221905452,슈에무라 슈에무라X원피스 컬렉션 얼티메이트+ 클렌징 오일 150ml,판매중,53000,있음 -> 품절
5221849807,톰포드뷰티 메탈리크 컬렉션 세트,판매중,216000,있음 -> 품절
5221846271,톰포드뷰티 블랙 오키드 컬렉션 세트,판매중,185000,있음 -> 품절
5221830595,에스티 로더 뷰티풀 앱솔뤼 50ml,판매중,143000,있음 -> 품절
5221828514,에스티 로더 2020 홀리데이 룩스 투 엔비,판매중,110000,있음 -> 품절
5221794703,맥 2020 홀리데이 맥 스파클러 스타터 키트: 브러시,판매중,82000,있음 -> 품절
5221790858,맥 2020 홀리데이 맥 로켓 투 페임 아이섀도우 팔레트,판매중,52000,있음 -> 품절
5218328699,라프레리 엑스트레 오브 스킨 캐비아 퍼밍 콤플렉스 30ml,판매중,257000,있음 -> 품절
5218308458,라프레리 안티-에이징 데이 크림 SPF30 아쎌루라 프로텍션 컴플렉스 50ml,판매중,327000,있음 -> 품절
5218302306,라프레리 안티-에이징 나이트 크림 50ml,판매중,327000,있음 -> 품절
5218295340,라프레리 안티-에이징 래피드 리스폰스 부스터 50ml,판매중,424000,있음 -> 품절
5218292285,라프레리 쎌루라 스위스 아이스 크리스탈 오일 30ml,판매중,455000,있음 -> 품절
5218289274,라프레리 스킨 캐비아 럭스 아이 크림 20ml,판매중,491000,있음 -> 품절
5217594879,라프레리 스킨 캐비아 크리스탈린 콘센트레 30ml,판매중,623000,있음 -> 품절
5217546753,라프레리 쎌루라 파워 차지 나이트 40ml,판매중,722000,있음 -> 품절
5217526685,라프레리 플래티늄 래어 쎌루라 라이프-로션 115ml,판매중,862000,있음 -> 품절
5215455264,라프레리 스킨 캐비아 럭스 크림 프리미어 100ml,판매중,1190000,있음 -> 품절
5215451789,라프레리 플래티늄 래어 오뜨-레쥬베네이션 아이 엘릭시어 15ml,판매중,1300000,있음 -> 품절
5209086716,조르지오아르마니 립 마에스트로 베스트 컬러 미니 키트,판매중,83000,있음 -> 품절
5208668976,키엘 투명 에센스 50ml 홀리데이 에디션 2020,판매중,108000,있음 -> 품절
5198298744,AESOP 이솝 젠틀 페이셜 클렌징 밀크 - 200ml,판매중,60000,있음 -> 품절
5183350032,나스 브론지 보야지 컬렉션 미니 오일 인퓨즈드 립 틴트 듀오,판매중,34000,있음 -> 품절
5183328747,디올 홀리데이 꾸뛰르 컬렉션 - 사틴 아이_립 에센셜,판매중,87000,있음 -> 품절
5183320349,디올 루즈 꾸뛰르 컬렉션 골든 나이트,판매중,215000,있음 -> 품절
5183153072,러쉬 마스크 오브 매그너민티 315g - 페이스 앤 보디 마스크팩,품절,40000,품절 -> 있음
5183126243,러쉬  더티 200ml - 보디 스프레이/바디 스프레이,품절,50000,품절 -> 있음
5149338227,톰포드뷰티 블랙 오키드 퍼퓸 트래블 스프레이,판매중,89000,있음 -> 품절
5142618603,시세이도 아치라이너 잉크 - 시부이블랙,판매중,36000,있음 -> 품절
5142581881,시세이도 임페리얼래쉬 마스카라잉크 워터프루프 - 수미 블랙,판매중,39000,있음 -> 품절
5142010661,시세이도 NEW 컴플리트 클렌징 마이크로 폼,판매중,53000,있음 -> 품절
5141846444,시세이도 선물 맨 베이직 세트 - 맨 베이직 세트,판매중,93000,있음 -> 품절
5141844745,시세이도 얼티뮨 아이 컨센트레이트 미백 3종 증정,판매중,95000,있음 -> 품절
5141841979,시세이도 선물 얼티뮨 레드 디펜스 세럼 30ml 세트,판매중,95000,있음 -> 품절
5141836356,시세이도 베네피앙스 링클 스무딩 컨투어 세럼 30ml 여행용 샘플 4종 증정,판매중,110000,있음 -> 품절
5141830456,시세이도 10 NEW 바이탈 퍼펙션 아이 크림 세트,판매중,115000,있음 -> 품절
5141819195,시세이도 바이탈 퍼펙션 리프팅 마스크 6매,판매중,120000,있음 -> 품절
5135513546,시세이도 선물 업리프팅 앤 퍼밍 크림 인리치드 대용량 세트,판매중,168000,있음 -> 품절
5135474319,시세이도 단독7 NEW 벚꽃 브라이트닝 세럼 점보 세트,판매중,200000,있음 -> 품절
5135458889,시세이도 선물 바이탈 퍼펙션 베이직 세트,판매중,230000,있음 -> 품절
5134830166,크리니크 안티-블레미쉬 솔루션즈 클렌징 폼 125ml,판매중,36000,있음 -> 품절
5134822990,크리니크 포 맨 엑스폴리에이팅 토닉 200ml,판매중,36000,있음 -> 품절
5134768551,크리니크 안티-블레미쉬 솔루션 크리니컬 클리어링 젤 30ml,판매중,43000,있음 -> 품절
5134760268,크리니크 NEW 포맨 맥시멈 하이드레이터 아이 96-아워 하이드로 컨센트레이트,판매중,44000,있음 -> 품절
5134748702,크리니크 이븐 베터 글로우 라이트 리플렉팅 메이크업 SPF17 PA++ 30ml,판매중,47000,있음 -> 품절
5134332874,크리니크 프레쉬 프레스드 리뉴잉 파우더 클렌저 위드 퓨어 비타민 C 14g,판매중,50000,있음 -> 품절
5134292711,크리니크 모이스춰 써지 하이드레이팅 쿠션 컴팩트 SPF33 PA+++,판매중,55000,있음 -> 품절
5134247646,크리니크 포 맨 수퍼 에너자이저 SPF 25 PA+++ 안티-퍼티그 하이드레이팅 컨센트레이트 (48ml),판매중,64000,있음 -> 품절
5134226223,크리니크 포어 리파이닝 솔루션 코렉팅 세럼 30ml,판매중,72000,있음 -> 품절
5134221439,크리니크 NEW 프레쉬 프레스드 리페어 크리니컬 엠디 멀티-디멘셔널 에이지 트랜스포,판매중,98000,있음 -> 품절
5134217190,크리니크 NEW 프레쉬 프레스드 리페어 크리니컬 엠디 멀티-디멘셔널 에이지 트랜스포머 듀오 레스컬프 + 리볼류마이즈,판매중,98000,있음 -> 품절
5134211582,크리니크 프레쉬 프레스드 데일리 부스터 위드 퓨어 비타민 C 10% 34ml,판매중,130000,있음 -> 품절
5134208605,크리니크 프레쉬프레스드 크리니컬 퓨어 비티민 씨 10%+안티링클 오버나이트 부스터,판매중,130000,있음 -> 품절
5132567372,스쿠 엔리치 포밍 워시,판매중,50000,있음 -> 품절
5132500269,키엘 칼렌듈라 꽃잎 토너 점보 세트,판매중,102000,있음 -> 품절
5132456618,키엘 키엘 투명 에센스 50ml 세트,품절,105000,품절 -> 있음
5132010366,스쿠 트리트먼트 세럼 프라이머,품절,73000,품절 -> 있음
5128741990,조말론런던 라임 바질 앤 만다린 바디 앤 핸드 워시 100ml,품절,33000,품절 -> 있음
5128677740,조말론런던 라임 바질 앤 만다린 여행용 캔들 60g,판매중,52000,있음 -> 품절
5128644186,조말론런던 라임 바질 앤 만다린 바디 앤 핸드 워시 250ml,판매중,60000,있음 -> 품절
5128632959,조말론런던 그레이프프루트 바디 앤 핸드 워시 250ml,판매중,60000,있음 -> 품절
5128628780,조말론런던 넥타린 블로썸 앤 허니 바디 앤 핸드 워시 250ml,판매중,60000,있음 -> 품절
5128624815,조말론런던 오렌지 블로썸 바디 앤 핸드 워시 250ml,판매중,60000,있음 -> 품절
5128619546,조말론런던 와일드 블루벨 바디 앤 핸드 워시 250ml,판매중,60000,있음 -> 품절
5128043369,조말론런던 잉글리쉬 페어 앤 프리지아 센트 투 고 20g,판매중,69000,있음 -> 품절
5127990710,조말론런던 넥타린 블로썸 앤 허니 바디 앤 핸드 로션 250ml,판매중,80000,있음 -> 품절
5127973282,조말론런던 포머그래니트 누와 바디 앤 핸드 로션 250ml,판매중,80000,있음 -> 품절
5127887157,조말론런던 잉글리쉬 페어 앤 프리지아 센트 써라운드 룸 스프레이 175ml,판매중,86000,있음 -> 품절
5127853916,조말론런던 라임 바질 앤 만다린 센트 써라운드 룸 스프레이 175ml,판매중,86000,있음 -> 품절
5127842685,조말론런던 허니서클 앤 다바나 홈 캔들 200g,판매중,87000,있음 -> 품절
5127776010,조말론런던 앰버 앤 라벤더 코롱 30ml,판매중,96000,있음 -> 품절
5127755031,조말론런던 오렌지 블로썸 코롱 30ml,판매중,96000,있음 -> 품절
5126853580,조말론런던 비타민 E 바디 밤 185ml,판매중,107000,있음 -> 품절
5126845596,조말론런던 블랙베리 앤 베이 바디 크림 175ml,품절,108000,품절 -> 있음
5126828995,조말론런던 오렌지 블로썸 바디 크림 175ml,판매중,108000,있음 -> 품절
5126793737,조말론런던 벨벳 로즈 앤 오드 드라이 바디 오일 100ml,판매중,108000,있음 -> 품절
5126786545,조말론런던 와일드 블루벨 센트 써라운드 디퓨저 165ml,판매중,116000,있음 -> 품절
5126779130,조말론런던 포머그래니트 누와 센트 써라운드 디퓨저 165ml,판매중,116000,있음 -> 품절
5126770563,조말론런던 레드 로즈 센트 써라운드 디퓨저 165ml,판매중,116000,있음 -> 품절
5126766576,조말론런던 잉글리쉬 페어 앤 프리지아 센트 써라운드 디퓨저 165ml,판매중,116000,있음 -> 품절
5126763289,조말론런던 라임 바질 앤 만다린 센트 써라운드 디퓨저 165ml,판매중,116000,있음 -> 품절
5126756766,조말론런던 피오니 앤 블러쉬 스웨이드 센트 써라운드 디퓨저 165ml,판매중,116000,있음 -> 품절
5126750736,조말론런던 벨벳 로즈 앤 오드 바디 크림 175ml,판매중,130000,있음 -> 품절
5126577534,조말론런던 머르 앤 통카 센트 써라운드 디퓨저 165ml,판매중,141000,있음 -> 품절
5126572571,조말론런던 벨벳 로즈 앤 오드 센트 써라운드 디퓨저 165ml,판매중,141000,있음 -> 품절
5126564287,조말론런던 비타민 E 바디 트리트먼트 스크럽 600g,판매중,142000,있음 -> 품절
5126536165,조말론런던 자스민 삼박 앤 메리골드 코롱 인텐스 50ml,판매중,167000,있음 -> 품절
5126490378,조말론런던 미모사 앤 카다멈 코롱 100ml,품절,192000,품절 -> 있음
5126427130,조말론런던 브라이덜 레이스 잉글리쉬 페어 앤 프리지아 코롱 100ml - 데이지 리프,판매중,206000,있음 -> 품절
5126347841,시슬리 뺑쏘 트라쐬르 브러쉬,판매중,57000,있음 -> 품절
5126327076,시슬리 뺑쏘 옹브뢰르 브러쉬,판매중,64000,있음 -> 품절
5126323650,시슬리 뺑쏘 에스통뻬르 브러쉬,판매중,64000,있음 -> 품절
5126314067,시슬리 뺑쏘 퐁 드 뗑 플루이드 브러쉬,판매중,67000,있음 -> 품절
5126291860,시슬리 뺑쏘 휘또-뚜쉬 브러쉬,판매중,78000,있음 -> 품절
5126029439,시슬리 끄렘므 공망뜨 52g,판매중,105000,있음 -> 품절
5125854549,시슬리 휘또 블랑 라이트닝 포밍 클렌져 100ml,판매중,150000,있음 -> 품절
5125848419,시슬리 마스끄 꽁뚜르 데 지유 30ml,판매중,155000,있음 -> 품절
5125838845,시슬리 휘또 블랑 라이트닝 클렌징 밀크 200ml,판매중,165000,있음 -> 품절
5125837493,시슬리 휘또 블랑 라이트닝 토닝 로션 200ml,판매중,170000,있음 -> 품절
5125616277,시슬리 끄렘므 꼴라젠 에 모브 46g,판매중,225000,있음 -> 품절
5125608837,시슬리 시슬리아 랭테그랄 앙티 아쥬 아이 앤 립 콘투어 크림 15ml,판매중,240000,있음 -> 품절
5125574697,시슬리 2019 블랙로즈크림마스끄+블랙로즈스킨인퓨전크림 세트,판매중,364000,있음 -> 품절
5125561444,시슬리 휘또 블랑 브라이트닝 데일리 디펜스 플루이드 SPF 50 + 50ml,판매중,365000,있음 -> 품절
5125545454,시슬리 시슬리아 꽁쌍트레 에끌라 30ml,판매중,530000,있음 -> 품절
5124916504,슈에무라 스테이지 퍼포머 프레쉬 탑코트 메이크업 픽스 미스트,판매중,39000,있음 -> 품절
5124799445,슈에무라 내츄럴 18 브러쉬,판매중,52000,있음 -> 품절
5124772211,슈에무라 콜린스키 5R (컨실리 브러쉬),판매중,55000,있음 -> 품절
5124731056,슈에무라 내츄럴 18R 레드 (페이스 브러쉬),판매중,65000,있음 -> 품절
5124593853,슈에무라 콜린스키 11 (아이섀도우 브러쉬),판매중,110000,있음 -> 품절
5124571922,슈에무라 얼티메이트 서블라임 뷰티 클렌징 오일 450ml,판매중,135000,있음 -> 품절
5124064329,록시땅 시어 베이비 젠틀 앤 러블리 모이스처라이징 밀크 300ml,품절,42000,품절 -> 있음
5120391753,톰포드뷰티 립 락카 15ml,판매중,45000,있음 -> 품절
5120108630,톰포드뷰티 크림 앤 파우더 아이 컬러 - 골든 피치,판매중,65000,있음 -> 품절
5120098598,톰포드뷰티 크림 앤 파우더 아이 컬러 - 플뢰르 네쥐,판매중,65000,있음 -> 품절
5120088217,톰포드뷰티 울트라 랭스 마스카라 8ml,판매중,66000,있음 -> 품절
5119964868,톰포드뷰티 톰 포드 포 맨 브로우 디파이너,판매중,60000,있음 -> 품절
5119633827,톰포드뷰티 오드 우드 샤워 젤 250ml,판매중,101000,있음 -> 품절
5119550072,톰포드뷰티 셰이드 앤 일루미네이트 리퀴드 파운데이션 브러시,판매중,110000,있음 -> 품절
5119450909,톰포드뷰티 블랙 오키드 EDP 30ml,판매중,125000,있음 -> 품절
5119423642,톰포드뷰티 포 맨 EDT 100ml,판매중,180000,있음 -> 품절
5119417563,톰포드뷰티 쏠레이 네쥐 EDP 30ML,판매중,185000,있음 -> 품절
5119371653,톰포드뷰티 옴브레 레더 EDP 100ML,판매중,248000,있음 -> 품절
5119310608,톰포드뷰티 화이트 스웨이드 EDP 50ML,판매중,318000,있음 -> 품절
5119281225,톰포드뷰티 토바코 오드 EDP 50ml,판매중,318000,있음 -> 품절
5119258777,톰포드뷰티 플뢰르 드 포르토피노 EDP 50ml,판매중,318000,있음 -> 품절
5119236837,톰포드뷰티 토스카나 레더 EDP 50ml,판매중,318000,있음 -> 품절
5119134213,톰포드뷰티 토스카나 레더 EDP 100ml,판매중,430000,있음 -> 품절
5119121100,톰포드뷰티 쟈스민 루쥬 EDP 100ml,판매중,430000,있음 -> 품절
5118993963,렙시리즈 프로 LS 올-인-원 훼이스 하이드레이팅 젤 75ml,판매중,39000,있음 -> 품절
5118989326,랩시리즈 프로 LS 올-인-원 훼이스 트리트먼트 50ml,판매중,39000,있음 -> 품절
5118982248,랩시리즈 NEW 레스큐 워터 젤 클렌저 100ml,판매중,40000,있음 -> 품절
5118975790,렙시리즈 오일 컨트롤 클레이 클렌저 + 마스크 100ml,판매중,40000,있음 -> 품절
5118821046,랩시리즈 에이지 레스큐+ 아이 테라피 15ml,판매중,54000,있음 -> 품절
5118809184,랩시리즈 데이 레스큐 디펜스 로션 SPF 35++++ 50ml,판매중,52000,있음 -> 품절
5118786010,랩시리즈 맥스 LS 데일리 리뉴잉 클렌저 150ml,판매중,59000,있음 -> 품절
5118747709,랩시리즈 신제품 레스큐 워터 에멀전 Size Up 세트 (+대용량 샘플 34ml 추가 증정),판매중,62000,있음 -> 품절
5118736925,랩시리즈 NEW 레스큐 워터 에멀전 100ml,판매중,62000,있음 -> 품절
5118727252,랩시리즈 NEW 레스큐 워터 에멀전 Size Up 세트 (+21ml 추가 증정),판매중,62000,있음 -> 품절
5118702848,랩시리즈 수분에센스 솔리드 워터 에센스 Size Up 세트 (+21ml 추가 증정),판매중,72000,있음 -> 품절
5118687004,랩시리즈 에이지 레스큐 플러스 워터-차지드 젤 크림 50ml,품절,70000,품절 -> 있음
5118636447,랩시리즈 맥스 LS 파워 V 인스턴트 아이 리프트 15ml,판매중,80000,있음 -> 품절
5118626695,랩시리즈 안티에이징 퓨처 레스큐 리페어 세럼 Size up 세트,판매중,90000,있음 -> 품절
5118620048,랩시리즈 안티에이징 퓨처 레스큐 리페어 세럼 50ml Size up 세트 (+30ml 추가 증정),판매중,85000,있음 -> 품절
5118612957,랩시리즈 퓨처 레스큐 리페어 세럼 50ml,판매중,85000,85000 -> 90000,있음 -> 품절
5118605809,랩시리즈 맥스 LS 파워 V 리프팅 로션 50ml,판매중,100000,있음 -> 품절
5118601080,랩시리즈 맥스 LS 파워 V 리프팅 세럼 30ml,판매중,110000,있음 -> 품절
5118592834,"랩시리즈 BEST 레스큐 워터로션&에이지 로션 세트 (29,000원 샘플+펌프)",판매중,121000,있음 -> 품절
5118584745,랩시리즈 맥스 LS 파워 V 크림 50ml,판매중,125000,있음 -> 품절
5118540706,랩시리즈 맥셀런스 더 싱귤러 크림 50ml,판매중,250000,있음 -> 품절
5116975949,랑콤 라 뉘 트레조 머스크 디아망 오 드 퍼퓸 50ml,판매중,99000,있음 -> 품절
5116969654,랑콤 제니피끄 아이 크림 15ml 세트,판매중,99000,있음 -> 품절
5116963713,랑콤 어드밴스드 제니피끄 아이 크림 15ml,판매중,99000,있음 -> 품절
5116938198,랑콤 이드라젠 수분 케어 기초 세트 (토너+에멀전),판매중,118000,있음 -> 품절
5116684761,랑콤 라 뉘 트레조 머스크 디아망 오 드 퍼퓸 75ml,판매중,123000,있음 -> 품절
5116673971,랑콤 제니피끄 360° 아이 마스크 10g- 7매,판매중,126000,있음 -> 품절
5116664418,랑콤 레네르지 탄력 리프팅 마스크,판매중,126000,있음 -> 품절
5116618798,랑콤 압솔뤼 장미 꽃잎 로션 150ml,판매중,135000,있음 -> 품절
5116598660,랑콤 미라클 오 드 퍼퓸 100ml,판매중,149000,있음 -> 품절
5116397533,랑콤 압솔뤼 소프트 크림 60ml,판매중,410000,있음 -> 품절
5108161693,에스티로더 퍼펙틀리 클린 멀티 액션 폼 클렌저/퓨리파잉 마스크 150ml,판매중,45000,있음 -> 품절
5108115775,에스티로더 더블 웨어 제로-스머지 렝쓰닝 마스카라 6ml - 01 블랙,판매중,44000,있음 -> 품절
5107998795,에스티로더 테이크잇 어웨이 리무버 로션 200ml,판매중,48000,있음 -> 품절
5107995008,에스티로더 스트레스 릴리프 아이 마스크 11ml,판매중,48000,있음 -> 품절
5107953964,에스티로더 브론즈 가데스 매트 앤 글로우 브론징 트리오,판매중,58000,있음 -> 품절
5107747101,에스티로더 크레센트 화이트 브라이트닝 BB크림 앤 브라이트닝 밤 SPF50,판매중,66000,있음 -> 품절
5107180223,에스티로더 뷰티풀 오 드 퍼퓸 스프레이 30ml,판매중,79000,있음 -> 품절
5107031076,에스티로더 퓨어 화이트 린넨 오 드 퍼퓸 스프레이 50ml,판매중,95000,있음 -> 품절
5106994213,에스티로더 마이크로 에센스 아쿠아슈티컬 미스트,판매중,97000,있음 -> 품절
5106974345,에스티로더 어드밴스드 나이트 리페어 수퍼차지드 아이 젤 크림,판매중,99000,있음 -> 품절
5106928499,에스티로더 센슈어스 누드 오 드 퍼퓸 스프레이 50ml,판매중,110000,있음 -> 품절
5106904595,에스티로더 어드밴스드 나이트 리페어 파워호일 마스크 (100ml (4pcs)),판매중,116000,있음 -> 품절
5106894565,에스티로더 뷰티풀 오 드 퍼퓸 스프레이 75ml,판매중,124000,있음 -> 품절
5106630948,에스티로더 모던 뮤즈 EDP 50ml,판매중,132000,있음 -> 품절
5106615584,에스티로더 마이크로 에센스 스킨 액티베이팅 트리트먼트 로션 200ml,판매중,140000,있음 -> 품절
5106599066,에스티로더 리-뉴트리브 얼티미트 리프트 유스 트리트먼트 로션,판매중,142000,있음 -> 품절
5106566463,에스티로더 리바이탈라이징 수프림+ 파워 크림,판매중,147000,있음 -> 품절
5106544066,에스티로더 리바이탈라이징 수프림 플러스 나이트 인텐시브 리스토러티브 크림,판매중,155000,있음 -> 품절
5106500294,에스티로더 퍼펙셔니스트 프로 래피드 브라이트닝 트리트먼트,품절,165000,품절 -> 있음
5106395910,에스티로더 리바이탈라이징 수프림+ 파워 소프트 크림,판매중,177000,있음 -> 품절
5106370648,에스티로더 마이크로 에센스 프레시 스킨 액티베이팅 트리트먼트 로션 40,판매중,210000,있음 -> 품절
5106353746,에스티로더 리-뉴트리브 얼티미트 리프트 리제너레이팅 유스 아이 크림 리치,판매중,225000,있음 -> 품절
5106345027,에스티로더 NY 리-뉴트리브 리제너레이팅 유스 아이크림 세트,판매중,225000,있음 -> 품절
5106337233,에스티로더 리-뉴트리브 얼티미트 리프트 리제너레이팅 유스 아이 크림,판매중,225000,있음 -> 품절
5106279309,에스티로더 리-뉴트리브 얼티미트 리프트 에이지-코렉팅 크림 50ml,판매중,405000,405000 -> 409000,있음 -> 품절
5106272212,에스티로더 리-뉴트리브 얼티미트 리프트 에이지-코렉팅 세럼 30ml,판매중,405000,있음 -> 품절
5106121915,에스티로더 NY 리-뉴트리브 리제너레이팅 유스 크림 세트,판매중,409000,있음 -> 품절
5106108588,에스티로더 리-뉴트리브 얼티미트 리프트 리제너레이팅 유스 크림 리치,판매중,409000,있음 -> 품절
5106098637,에스티로더 리-뉴트리브 얼티미트 리프트 리제너레이팅 유스 크림,판매중,409000,있음 -> 품절
5106078565,에스티로더 리-뉴트리브 얼티미트 리프트 리제너레이팅 유스 세럼,판매중,409000,있음 -> 품절
