5105693435,에스티로더 10월 리-뉴트리브 다이아 세럼 세트,판매중,557000,있음 -> 품절
5105688102,에스티로더 리-뉴트리브 얼티미트 다이아몬드 듀얼 인퓨전,판매중,557000,있음 -> 품절
5105682640,에스티로더 리-뉴트리브 다이아몬드 에너지 크림 리치,판매중,557000,있음 -> 품절
5105392234,메이크업포에버 228 프리시젼 아이 섀이더 브러쉬 미디엄,품절,37000,품절 -> 있음
5105382364,메이크업포에버 익세시브 래쉬 마스카라 8.5ml,판매중,38000,있음 -> 품절
5105269220,메이크업포에버 더블 엔디드 앵글드 아이브로우 앤 아이래쉬 브러쉬 274,판매중,40000,있음 -> 품절
5105225326,메이크업포에버 242 아이 블렌더 브러쉬,판매중,46000,있음 -> 품절
5105213258,메이크업포에버 밀착브러쉬 파운데이션 브러쉬 미디엄 106,판매중,49000,있음 -> 품절
5105179468,메이크업포에버 UV 프라임 SPF50/PA+++ 30ml,판매중,54000,있음 -> 품절
5105158400,메이크업포에버 프로 라이트 퓨전 - #2,판매중,55000,있음 -> 품절
5104870088,메이크업포에버 아기 피부결 파우더 ULTRA HD 프레스드 파우더 키트,판매중,67000,있음 -> 품절
5104791642,로라메르시에 NEW 수딩 아이 메이크업 리무버,판매중,35000,있음 -> 품절
5104084254,로라메르시에 NEW 하이드레이팅 립 밤,판매중,37000,있음 -> 품절
5103508084,로라메르시에 NEW 퓨리파잉 미셀라 워터,판매중,42000,있음 -> 품절
5103426339,로라메르시에 클레이 스머지 브러쉬,판매중,43000,있음 -> 품절
5103268804,로라메르시에 샤인 컨트롤 프레스드 세팅 파우더 7.2g,판매중,53000,있음 -> 품절
5103180417,로라메르시에 한정 퓨어 캔버스 프라이머 25ml 듀오- 블러링 & 하이드,판매중,60000,있음 -> 품절
5102849887,로라메르시에 NEW 퓨어 캔버스 파워 프라이머 슈퍼차지드 에센스,판매중,75000,있음 -> 품절
5102573614,로라메르시에 오 드 퍼퓸 50ml - 오드륀,판매중,105000,있음 -> 품절
5102343368,조르지오아르마니 하이 프레시젼 브로우 펜슬 ,판매중,39000,있음 -> 품절
5100702389,조르지오아르마니 프리마 립 앤 아이 프라이머 15ml (립 앤 아이 퍼펙터),판매중,75000,있음 -> 품절
5100684197,조르지오아르마니 아쿠아 디 지오 옴므 50ml 세트(+밤 75ml 증정),판매중,93000,있음 -> 품절
5100646632,조르지오아르마니 립 마에스트로 베스트 컬러 미니 키트 세트,판매중,83000,있음 -> 품절
5100560353,조르지오아르마니아쿠아 디 지오 프로폰도 EDP 40ml,판매중,99000,있음 -> 품절
5100535831,조르지오아르마니 아쿠아 디 지오 100ml 세트 (밤 75ml+미니어처 5ml 증정),판매중,120000,있음 -> 품절
5100519873,조르지오아르마니 블렌더 브러쉬,판매중,125000,있음 -> 품절
5100507149,조르지오아르마니 단독 한정판 3 씨 패션 레드 마에스트로,판매중,145000,있음 -> 품절
5099456107,맥 211 포인티드 라이너 브러시,판매중,38000,있음 -> 품절
5099408961,맥 184 듀오 파이버 팬 브러시,품절,38000,품절 -> 있음
5099378857,맥 프렙+프라임 에센셜 오일 그레이프프룻 & 카모마일,판매중,40000,있음 -> 품절
5099347588,맥 252 라지 쉐이더 브러시,판매중,47000,있음 -> 품절
5099265943,맥 스튜디오 모이스처 크림,품절,49000,품절 -> 있음
5099256985,맥 라이트풀 C + 코랄 그라스 소프트닝 로션,판매중,49000,있음 -> 품절
5098739510,맥 하이퍼 리얼 글로우 팔레트 / 플래쉬 + 오우,판매중,59000,있음 -> 품절
5098717878,맥 하이퍼 리얼 글로우 팔레트 / 겟 릿,판매중,59000,있음 -> 품절
5098709293,맥 하이퍼 리얼 글로우 팔레트 / 쉬미 피치,판매중,59000,있음 -> 품절
5098366854,나스 브로우 디파이닝 브러쉬 #48,판매중,35000,있음 -> 품절
5098317833,나스 스머지 프루프 아이섀도우 베이스 8g,판매중,36000,있음 -> 품절
5098202732,나스 에프터글로우 립 밤 오르가X,판매중,37000,있음 -> 품절
5098105782,나스 엣 앤 드라이 아이섀도우 브러쉬 #49,판매중,39000,있음 -> 품절
5098059254,나스 앵글드 아이라이너 브러쉬 #47,판매중,39000,있음 -> 품절
5098048485,나스 프리시전 컨투어 브러쉬 #44,판매중,39000,있음 -> 품절
5097556483,나스 가부키 쿠도키 브러쉬,판매중,58000,있음 -> 품절
5097534499,나스 블러쉬 브러쉬 #20,판매중,62000,있음 -> 품절
5097527589,나스 컨투어 브러쉬 #21,판매중,62000,있음 -> 품절
5097522102,나스 웻 앤 드라이 블러쉬 브러쉬,판매중,62000,있음 -> 품절
5097389616,나스 가부키 미즈바케 브러쉬,판매중,75000,있음 -> 품절
5097386106,나스 가부키 미에 브러쉬,판매중,75000,있음 -> 품절
5097380792,나스 가부키 이타 브러쉬,판매중,75000,있음 -> 품절
5097373960,나스 프라이빗 파라다이스 컬렉션 네이키드 파라다이스 립 펜슬 코프레,판매중,79000,있음 -> 품절
5097292656,나스 가부키 보탄 브러쉬,판매중,98000,있음 -> 품절
5094860007,AESOP 이솝 레저렉션 아로마틱 핸드 밤 75ml,품절,31000,품절 -> 있음
5093058823,비오템 아쿠아파워 클렌저 125ml,판매중,38000,있음 -> 품절
5093015475,비오템 라이프 플랑크톤 마일드 크리미 필링 150ml,판매중,43000,있음 -> 품절
5092876963,비오템 아쿠아파워 올인원 프레시 로션-인-젤 200ml,판매중,53000,있음 -> 품절
5092857226,비오템 B아쿠아파워 올인원 프레시 로션-인-젤 200ml 세트,판매중,53000,있음 -> 품절
5092793097,비오템 아쿠아수르스 크림 젤 코쿤 50ml,판매중,54000,있음 -> 품절
5092249442,비오템 아쿠아틱 로션 애프터 쉐이브 200ml,판매중,54000,있음 -> 품절
5092233593,비오템 라이프 플랑크톤 피부강화 에센스 로션 75ml,판매중,65000,있음 -> 품절
5092224496,비오템 블루 테라피 레드 알개 탄력 큐어 앰플 15ml,판매중,64000,있음 -> 품절
5092221837,비오템 라이프 플랑크톤 아이크림 15ml,판매중,65000,있음 -> 품절
5092217909,비오템 UV 수프림 선크림 50ml,품절,65000,품절 -> 있음
5092194742,비오템 옴므 - UV 디펜스 자외선 차단제 점보 75ml,판매중,69000,있음 -> 품절
5092191509,비오템 포스 수프림 원에센스 100ml 세트,판매중,80000,있음 -> 품절
5092186654,비오템 옴므 포스 수프림 원 에센스 100ml,판매중,80000,있음 -> 품절
5092183409,비오템 라이프 플랑크톤 엘릭시어 안티-에이징 세럼 30ml,판매중,77000,있음 -> 품절
5091726212,비오템 블루 테라피 레드 알개 탄력 크림 50ml,판매중,82000,있음 -> 품절
5091718105,비오템 블루 멀티 크림 50ml,판매중,80000,있음 -> 품절
5091687066,비오템 라이프 플랑크톤 온천수 에센스 점보 200ml 세트,판매중,86000,있음 -> 품절
5091560564,라이프 플랑크톤 온천수 에센스 200ml,판매중,86000,있음 -> 품절
5091545843,비오템 라이프 플랑크톤 클리어 에센스 점보 200ml,판매중,86000,있음 -> 품절
5091447369,비오템 블루 테라피 세럼 속 탱탱오일 50ml,판매중,90000,있음 -> 품절
5091437882,비오템 비오베르제뛰르 튼살 크림 점보 400ml 세트,판매중,89000,있음 -> 품절
5091428424,비오템 포스 수프림 모이스춰라이저 100ml 세트,판매중,102000,있음 -> 품절
5091409412,비오템 라이프 플랑크톤 엘릭시어 안티-에이징 세럼 50ml,판매중,113000,있음 -> 품절
5091193993,디올 크렘 아브리코트,판매중,35000,있음 -> 품절
5090591000,디올 미스 디올 블루밍 센티드 솝,판매중,37000,있음 -> 품절
5090535323,디올 옴므 데오도란트 스틱,판매중,44000,있음 -> 품절
5090532081,디올 옴므 데오도란트 스프레이,판매중,43000,43000 -> 44000,있음 -> 품절
5089360733,디올 조이 퍼퓸드 데오도란트,판매중,55000,있음 -> 품절
5089333508,디올 미스 디올 퍼퓸드 데오도란트,판매중,55000,있음 -> 품절
5088049315,디올 캡춰 토탈 하이-퍼포먼스 젠틀 클렌저,품절,63000,품절 -> 있음
5087995260,디올 쟈도르 프레셔스 바디 미스트,판매중,68000,있음 -> 품절
5087530801,디올 소바쥬 애프터쉐이브 밤 100ml,판매중,80000,있음 -> 품절
5087500712,디올 쁘와종 오 드 뚜왈렛 30ml,품절,81000,품절 -> 있음
5085319679,디올 미스디올 앱솔루틀리 블루밍 오 드 퍼퓸 30ml,판매중,99000,있음 -> 품절
5085313330,디올 옴므 오 드 뚜왈렛 50ML,판매중,99000,있음 -> 품절
5083609099,디올 미스 디올 오 드 퍼퓸 30ml,판매중,99000,있음 -> 품절
5083560850,디올 캡춰 토탈 드림스킨 1 미닛 마스크,판매중,100000,있음 -> 품절
5083196828,디올 쟈도르 인 조이 오 드 뚜왈렛 50ml,판매중,124000,있음 -> 품절
5083189717,디올 미스 디올 오 드 뚜왈렛 50ml,판매중,128000,있음 -> 품절
5081452559,디올 조이 바이 디올 오 드 퍼퓸 90ml,판매중,224000,있음 -> 품절
5081318364,입생로랑 리브르 오 드 빠르펭 90ml,판매중,219000,있음 -> 품절
5081295458,디올 쟈도르 오 드 퍼퓸 150ml,판매중,280000,있음 -> 품절
5081291161,디올 프레스티지 라 마이크로-륄 드 로즈 어드밴스드 30ML,판매중,319000,있음 -> 품절
5081279379,디올 프레스티지 라 마이크로 륄 드 로즈 어드밴스드 50ML,판매중,429000,있음 -> 품절
5079509899,디올 프레스티지 라 크렘므 텍스처 리치 리필 50ml,판매중,423000,있음 -> 품절
5079458369,디올 프레스티지 라 크렘므 50ml,판매중,470000,있음 -> 품절
5079445211,디올 프레스티지 라이트-인-화이트 라 쏠루씨옹 뤼미에르,판매중,510000,있음 -> 품절
5069523180,키엘 훼이셜 퓨얼 에너자이징 토닉 포 맨 250ml,품절,36000,품절 -> 있음
5069416876,키엘 올리브 프룻 오일 딥플리 리페라티브 헤어 마스크 250ml,판매중,40000,있음 -> 품절
5069341974,키엘 훼이셜 퓨얼 모이스처라이저 75ml,판매중,43000,있음 -> 품절
5069302871,키엘 크렘 드 꼬르 250ml,품절,43000,품절 -> 있음
5068595131,키엘 올리브 프룻 오일 너리싱 컨디셔너 500ml,판매중,49000,있음 -> 품절
5068572073,키엘 블루 아스트린젠트 허벌 로션 500ml,판매중,49000,있음 -> 품절
5068521877,키엘 클리얼리 코렉티브 브라이트닝 앤 수딩 트리트먼트 워터 200ml,판매중,57000,있음 -> 품절
5068440064,NEW 라인 미니마이징 타겟티드 트라이앵글 패치 마스크,판매중,60000,있음 -> 품절
5068401705,키엘 울트라 훼이셜 모이스처라이저 250ml,품절,64000,품절 -> 있음
5068296036,키엘 투명 에센스 마스크 (25ml x 5개입),판매중,65000,있음 -> 품절
5068275056,키엘 미드나잇 리커버리 컨센트레이트 30ml,판매중,69000,있음 -> 품절
5068271521,키엘 수퍼 멀티 코렉티브 아이 오프닝 세럼 (스마트 아이세럼) 15ml,판매중,69000,있음 -> 품절
5066716702,"키엘 너리싱 올리브 프룻 오일 컨디셔너 (1000ml, 1L)",판매중,73000,있음 -> 품절
5066707713,키엘 울트라 훼이셜 크림 125ml,판매중,79000,있음 -> 품절
5066561356,키엘 칼렌듈라 세럼-인퓨즈드 워터 크림 100ml,판매중,97000,있음 -> 품절
5066398906,AESOP 이솝 페뷸러스 페이스 클렌저 100mL,품절,33000,품절 -> 있음
5066397108,AESOP 이솝 어메이징 페이스 클렌저 100mL,판매중,33000,있음 -> 품절
5066135002,AESOP 이솝 비 앤 티 밸런싱 토너 100mL,판매중,39000,있음 -> 품절
5066066285,AESOP 이솝 레저렉션 아로마틱 핸드 워시 500mL,품절,50000,품절 -> 있음
5066024601,AESOP 이솝 클래식 샴푸 500mL,품절,55000,품절 -> 있음
5065918630,AESOP 이솝 카밍 샴푸 500mL,품절,55000,품절 -> 있음
5063369608,AESOP 이솝 엘레멘탈 페이셜 배리어 크림 60ml,판매중,70000,있음 -> 품절
5063344208,AESOP 이솝 파슬리 씨드 안티 옥시던트 세럼 100mL (민감성),판매중,85000,있음 -> 품절
5063334994,AESOP 이솝 레저렉션 아로마틱 핸드 밤 500ml,품절,114000,품절 -> 있음
5061428705,AESOP 이솝 퍼펙트 페이셜 하이드레이팅 크림 60mL (건성),판매중,140000,있음 -> 품절
5059750228,AESOP 이솝 코리안더 씨드 바디 클렌저 500mL,판매중,56000,있음 -> 품절
5059743732,AESOP 이솝 젠틀 페이셜 클렌징 밀크 - 100ml,판매중,40000,있음 -> 품절
5058807737,AESOP 이솝 레졸루트 하이드레이팅 바디 밤 120mL,판매중,43000,있음 -> 품절
5058803175,AESOP 이솝 비터 오렌지 아스트린젠트 토너 200mL,판매중,63000,있음 -> 품절
5058765391,AESOP 이솝 퓨리파잉 페이셜 크림 클렌저 100mL,품절,45000,품절 -> 있음
5058657949,AESOP 이솝 인 투 마인즈 페이셜 토너 100mL,판매중,39000,있음 -> 품절
5058646020,AESOP 이솝 어메이징 페이스 클렌저 200mL,판매중,53000,있음 -> 품절
5058640790,AESOP 이솝 제라늄 리프 바디 밤 500mL,판매중,120000,있음 -> 품절
5058615904,AESOP 이솝 B 트리플 C 페이셜 밸런싱 젤 60mL (비 트리플 씨),판매중,145000,있음 -> 품절
5056845051,입생로랑 3D 올오버 글로우,판매중,87000,있음 -> 품절
5056580255,입생로랑 퓨어샷 퍼펙트 플럼퍼 크림,판매중,125000,있음 -> 품절
5056080452,입생로랑 리브르 오 드 빠르펭 30ml,판매중,99000,있음 -> 품절
5053815959,입생로랑 뚜쉬 에끌라 블러 퍼펙터 (핑크매직밤) 9.5g,판매중,72000,있음 -> 품절
5393970716,크리니크 핑크수분크림 75ml,판매중,55000,있음 -> 품절
5357876512,딥티크 캔들 70g,판매중,52000,있음 -> 품절
5357861510,딥티크 핸드앤바디젤 200ml,판매중,59000,있음 -> 품절
5357840708,딥티크 솔리드퍼퓸,품절,72000,품절 -> 있음
5350765585,딥티크 캔들 190g,판매중,82000,있음 -> 품절
5350746398,딥티크 오드뚜왈렛 50ml,판매중,132000,있음 -> 품절
5350717749,딥티크 오드뚜왈렛 100ml,판매중,175000,있음 -> 품절
5350700921,딥티크 오드퍼퓸 75ml,판매중,210000,있음 -> 품절
5327551306,스쿠 2021 SS 뉘앙스 아이라이너,판매중,38000,있음 -> 품절
5319688098,입생로랑 NEW 마블 팩트 (리필),판매중,55000,있음 -> 품절
5311220237,디올 캡춰 토탈 세럼 오퍼,판매중,175000,있음 -> 품절
5311216833,디올 스프링룩 디올 어딕트 립 글로우 오일,판매중,45000,있음 -> 품절
5311215740,디올 스프링룩 스틱 글로우,판매중,56000,있음 -> 품절
5311212939,디올 포에버 스킨 글로우 쿠션,판매중,84000,84000 -> 88000,있음 -> 품절
5306476286,디올 포에버 스킨 글로우 쿠션 - 디올 매니아 골드 에디션,판매중,88000,있음 -> 품절
5306452840,디올 NEW 루즈 디올 밤,품절,48000,품절 -> 있음
5291031064,바이레도 릴 플레르 오드퍼퓸 100ml,판매중,298000,있음 -> 품절
5259518563,라메르 모이스춰라이저 60ml 세트 (기적의 크림)- 모이스춰라이징 소프트 크림 모이스춰라이징 쿨 젤 크림 크렘 드 라 메르,판매중,410000,있음 -> 품절
5259494499,라메르 모이스춰라이저 60ml 세트 (기적의 크림)- 모이스춰라이징소프트크림 모이스춰라이징쿨젤크림 크렘드라메르,판매중,410000,있음 -> 품절
5259266048,라메르 기적의 크림 60ml 세트 (택 1)- 모이스춰라이징소프트크림 모이스춰라이징쿨젤크림 크렘드라메르,판매중,410000,있음 -> 품절
5244518014,로라메르시에 홀리데이 오프닝 나이트 치크 팔레트,판매중,79000,있음 -> 품절
5234470381,스쿠 2020 Spring Collection 글로우 터치 아이즈,판매중,48000,있음 -> 품절
5232629354,빅토리아시크릿 레이스&벨벳 트림 티팬티,판매중,37900,있음 -> 품절
5232627085,빅토리아시크릿 올오버 레이스 티팬티,판매중,34300,있음 -> 품절
5232618574,빅토리아시크릿 샤인 레이스 티팬티,판매중,34300,있음 -> 품절
5224306945,빅토리아시크릿 미디엄 리프트 푸시업 브라,판매중,128100,있음 -> 품절
5224006132,빅토리아시크릿  메이저 리프트 푸시업 브라 (2컵 추가),판매중,92700,있음 -> 품절
5221931925,슈에무라 슈에무라X원피스 컬렉션 립스틱- 래드개틀링 점핑플래쉬 크림슨차지 마론템포 기어프레임 누디로제 쿵푸펀치 럼블시나몬,판매중,40000,있음 -> 품절
5221855249,톰포드뷰티 아이 컬러 쿼드 익스트림 스파크,판매중,117000,있음 -> 품절
5221815427,메이크업포에버 NEW 리부트 루미나이저 2.5ML,판매중,42000,있음 -> 품절
5218327139,라프레리 스킨 캐비아 에센스-인-파운데이션 SPF25,판매중,280000,있음 -> 품절
5183393666,나스 브론지 보야지 컬렉션 페이스 세트,판매중,65000,있음 -> 품절
5183202926,입생로랑 2020홀리데이 루쥬 쀠르 꾸뛰르 -- 1 르 루즈 135 와일들리 루즈 137 와일들리 보르도 83 파이어리 레드,판매중,48000,있음 -> 품절
5142530641,시세이도 싱크로 밀착 쿠션 리필 세트,판매중,41000,있음 -> 품절
5142510448,시세이도 이너글로우 치크파우더,판매중,45000,있음 -> 품절
5142003468,시세이도 특별 글로우 쿠션 세트(+리필 정품+립스틱 미니),판매중,55000,있음 -> 품절
5142000770,시세이도 특별 셀프-리프레싱 쿠션 세트(+리필 정품+립스틱 미니),판매중,55000,있음 -> 품절
5141964749,시세이도 선물 NEW 파란자차 50ml 세트,판매중,58000,있음 -> 품절
5141953919,시세이도 싱크로 밀착 파운데이션 세트,판매중,68000,있음 -> 품절
5135601539,"시세이도 바이탈 퍼펙션 업리프팅 앤 퍼밍 크림, 크림 인리치드 50ml",판매중,140000,있음 -> 품절
5135579431,시세이도 선물 NEW 바이탈 퍼펙션 업리프팅 앤 퍼밍 크림 세트,판매중,140000,있음 -> 품절
5135524890,"시세이도 NEW 바이탈 퍼펙션 업리프팅 앤 퍼밍 크림, 크림 인리치드 75ml",판매중,168000,있음 -> 품절
5134317908,크리니크 이븐 베터 리프레쉬 하이드레이팅 & 리페어링 메이크업,판매중,51000,있음 -> 품절
5134312227,크리니크 이븐 베터 다크 스팟 디펜스 SPF50+/PA+++,판매중,51000,있음 -> 품절
5134297988,크리니크 이븐 베터 메이크업 브라이트닝 쿠션 컴팩트 SPF33/PA+++,판매중,55000,있음 -> 품절
5132436948,입생로랑 일리싯 누드 더 슬림 글로우 마뜨- 202 인설전트 레드 203 리스트릭티드 핑크 204 프라이빗 카민 207 일리걸 로지 누드 213 노 타부 칠리 214 일리싯 오렌지,판매중,48000,있음 -> 품절
5129302412,스쿠 NEW 더 크림 파운데이션,판매중,128000,있음 -> 품절
5126340862,시슬리 휘또-립 딜라이트 6g,판매중,58000,있음 -> 품절
5124899913,슈에무라 언리미티드 컨실러- 3라이트 4라이트 +4미디움 +5라이트 5리치 5미디움 5페어 +6라이트 +6미디움 7라이트 7미디움,판매중,39000,있음 -> 품절
5124825673,슈에무라 워터페인트:잉크,판매중,43000,있음 -> 품절
5124820928,슈에무라 브로우:스워드 아이브로우 펜슬 (오토 하드 포뮬라),판매중,47000,있음 -> 품절
5124817222,슈에무라 브로우:팔레트 (아이브로우 파우더) 2 x 1.6g,판매중,45000,있음 -> 품절
5124777441,슈에무라 스테이지 퍼포머 비비 퍼펙터 스킨스무딩 뷰티크림 에스피에프30 피에이++ 30ml,품절,55000,품절 -> 있음
5124769781,슈에무라 언리미티드 스틱 파운데이션,판매중,59000,있음 -> 품절
5120280408,톰포드뷰티 리미티드 립 컬러 매트,판매중,64000,있음 -> 품절
5120003540,톰포드뷰티 셰이드 앤 일루미네이트 소프트 래디언스 쿠션 리필 SPF45/PA+++ -0.3아이보리실크0.4로즈1.1웜샌드1.3누드아이보리1.4본2.0버프2.5린넨4.0폰,판매중,72000,있음 -> 품절
5119584543,톰포드뷰티 일루미네이팅 파우더 6g,판매중,101000,있음 -> 품절
5119561857,톰포드뷰티 트레이스레스 퍼펙팅 파운데이션 SPF15 30ml,판매중,105000,있음 -> 품절
5117245211,랑콤 뗑 클라리피끄 마블 컴팩트 파운데이션 세트,판매중,52000,있음 -> 품절
5107923113,에스티로더 퓨어 컬러 엔비 아이섀도우 팔레트,판매중,58000,있음 -> 품절
5106918615,에스티로더 리-뉴트리브 울트라 래디언스 파우더 메이크업 SPF 16/PA+++ (리필),판매중,113000,있음 -> 품절
5104700429,로라메르시에 브로우 디멘션 파이버 인퓨즈드 컬러 젤,판매중,36000,있음 -> 품절
5103880559,로라메르시에 롱웨어 립 라이너,판매중,37000,있음 -> 품절
5103570839,로라메르시에 아이 베이직스 5.1g -린넨 위트 플렉스,판매중,40000,있음 -> 품절
5103246218,로라메르시에 NEW 퓨어 캔버스 프라이머,판매중,55000,있음 -> 품절
5102916550,로라메르시에 NEW 플로리스 뤼미에르 쿠션 (다이아쿠션),판매중,69000,있음 -> 품절
5102252098,조르지오아르마니 BEST 립,판매중,47000,있음 -> 품절
5102123192,조르지오아르마니 립 마그넷 3.9m,판매중,47000,있음 -> 품절
5100711515,조르지오아르마니 래스팅 실크 파운데이션 세트 (+파운데이션 5ml 2개 증정),판매중,82000,있음 -> 품절
5100618328,조르지오아르마니 디자이너 메쉬 쿠션 세트(+블루 쿠션 파우치 증정),판매중,97000,있음 -> 품절
5100268110,맥 립글라스 -님펫트드리미러브차일드러스트러시안레드루비우리치럭스미스복스비터수윗미스놉스파이스스파이트씨-쓰루오베이비오이스터걸익스플리시트임패션드캔디박스캔디얌얌컬쳐드푸르르플리즈미헤로인,판매중,30000,있음 -> 품절
5100214370,맥 립스틱 (G)- 더즌카네이션듀보넷러시안레드런웨이히트레이디데인저루비우릴렌트리슬리레드마라케쉬맹그로브모란지베가스볼트브릭-오-라쏘쇼드씨쉬어임패션드칠리카인다섹시트로픽토닉,판매중,31000,있음 -> 품절
5099972515,립스틱 / 브론저,품절,33000,품절 -> 있음
5099855947,맥 버시컬러 바니쉬 크림 립 스테인 -노인터럽션라이크캔디비튼베이브쇼크잇투미스턱인러브시리얼스테인에퍼베센트옵틱스오렌지크러싱잇!투디익스트림트라이투스탑미플렉시핑크피치어플러쉬,판매중,34000,있음 -> 품절
5099795789,맥 샷 오브 컬러 립 오일 -레츠고스트리킨 뱅뱅베이비 샷샷샷 소풀온 쇼크컬처 오피스플링 월드투어 이모셔널아웃버스트 컴플리틀리블래스티드 케이팝보이프렌드 펀치드렁크러브 포켓풀오브선샤인,판매중,34000,있음 -> 품절
5099504056,맥 파우더 키스 리퀴드 립컬러 -갓어콜백데이트메이커디보티드투칠리리조트시즌맥스매쉬멀잇오버메이크잇패션!메이크러브투더카메라모어더미어러버닝러브빌리언달러스마일쏘리낫쏘리어리틀템드오버더토프,판매중,36000,있음 -> 품절
5099466831,맥 미네랄라이즈 블러쉬,품절,37000,품절 -> 있음
5099383926,맥 프렙+프라임 하이라이터,판매중,39000,있음 -> 품절
5099373170,맥 그레이트 브로우 - 링거링 스파이크드 토프,판매중,42000,있음 -> 품절
5099237928,맥 라이트풀 C+ 코랄 그라스 틴티드 프라이머 SPF45/PA++++,판매중,52000,있음 -> 품절
5098337961,나스 멀티 유즈 글로스,판매중,36000,있음 -> 품절
5098229247,나스 오르가X 컬렉션 오일 인퓨즈드 립 틴트- 오르가X 오르가XX,판매중,37000,있음 -> 품절
5098015233,나스 NEW 블러쉬- 도미네이트 돌체비타 딥쓰로트 러스터 리베르떼 범피라이드 비헤이브 세비지 스릴 아모르 어로우즈드 익지빗에이 일리싯 임패션드 젠 지나 타오스 타지마할 템피드토리드,판매중,40000,있음 -> 품절
5097941579,나스 어데이셔스 립스틱 4.2g,판매중,41000,있음 -> 품절
5097445012,나스 오르가X 컬렉션 쿼드 아이섀도우,판매중,68000,있음 -> 품절
5091163297,디올 컨투어 1.2g ,판매중,34000,있음 -> 품절
5090646707,디올 베르니,판매중,35000,있음 -> 품절
5090618541,디올 디올쇼 24H 스틸로 -016매트그레이076펄리실버091매트블랙176매트퍼플296매트블루466펄리브론즈471매트그린556펄리골드771매트토프781매트브라운851매트핑크861,판매중,36000,있음 -> 품절
5090516838,디올 립 글로우 오일,판매중,45000,있음 -> 품절
5089790782,디올 립 글로우,판매중,44000,44000 -> 45000,있음 -> 품절
5089723306,디올 NEW 핑크 패션쇼 쉐이드 출시 어딕트 스텔라 샤인 (전색상),판매중,48000,있음 -> 품절
5089602445,디올 루즈 디올 울트라 케어-68페탈455플라워480플뢰르블루580로즈우드635엑스테이즈707블리스749D-라이트750블러썸808카레스848위스퍼860플러트866로맨틱880참999,판매중,48000,있음 -> 품절
5089427618,디올 디올쇼 뉴 룩 10ml ,판매중,48000,있음 -> 품절
5088075055,디올 백스테이지 페이스 & 바디 파운데이션- 0CR 쿨 로지 0N 뉴트럴 0W웜 1.5N 뉴트럴 1C 쿨 1CR 쿨 로지 1N 뉴트럴 1W 웜 2.5N 뉴트럴 3N 뉴트럴,판매중,60000,있음 -> 품절
